[
  {
    "id": "9b1c2a5e-7b8d-4c1e-9a2b-000000000201",
    "code": "FRD001",
    "source": {
      "system": "fraud",
      "service": "fraud-vendor"
    },
    "entity": "FRAUD_CHECK",
    "timestamp": "2026-09-22T08:30:03.000Z",
    "actor": null,
    "data": {
      "checkId": "66f100000000000000000a01",
      "orderId": "66f100000000000000000001",
      "score": 12
    }
  }
]
